{
  "name": "detour-factor",
  "summary": "Analyze network directness",
  "description": "The detour-factor command measures how direct the road network is by comparing actual network distances to straight-line distances. A detour factor of 1.0 means perfectly direct routes; higher values indicate more circuitous paths.\n\nUseful for:\n- Network connectivity analysis\n- Urban planning assessment\n- Comparing different areas\n- Identifying areas with poor connectivity",
  "usage": [
    "osmfast detour-factor map.osm",
    "osmfast detour-factor map.osm --mode walk --sample 200",
    "osmfast detour-factor map.osm -f json -o analysis.json"
  ],
  "options": {
    "-m, --mode": "Travel mode: walk, bike, drive (default: drive)",
    "--sample": "Number of random point pairs to sample (default: 100)",
    "-f, --format": "Output format: text, json (default: text)",
    "-o, --output": "Output file (default: stdout)"
  },
  "output": "Detour factor statistics:\n- Mean, median, min, max detour factors\n- 10th and 90th percentiles\n- Interpretation (excellent/good/average/poor)\n- Sample route details\n\nTypical values: 1.1-1.3 (excellent), 1.3-1.5 (good), 1.5-1.8 (average), >1.8 (poor)",
  "examples": [
    ["Basic analysis", "osmfast detour-factor city.osm"],
    ["Walking network", "osmfast detour-factor city.osm --mode walk"],
    ["More samples", "osmfast detour-factor city.osm --sample 500"],
    ["Cycling network", "osmfast detour-factor city.osm --mode bike"],
    ["JSON output", "osmfast detour-factor city.osm -f json -o analysis.json"]
  ],
  "related": ["connectivity", "centrality", "bottleneck", "network"]
}
